title,slug,price,image1_url,description,category,sku,inventory_qty
Arrogance Tee,arrogance-tee,29.99,https://images.pexels.com/photos/1040945/pexels-photo-1040945.jpeg,Bold statement streetwear tee,Apparel,ARG-001,50
Gas Mask Tee,gas-mask-tee,34.99,https://images.pexels.com/photos/1183266/pexels-photo-1183266.jpeg,Edgy graphic tee with gas mask design,Apparel,GM-001,25
Lady Diamond Gas Mask Tee,lady-diamond-gas-mask-tee,34.99,https://images.pexels.com/photos/996329/pexels-photo-996329.jpeg,Women's version of the iconic gas mask design,Apparel,LDG-001,30
Chill Don't Pay Bills Crewneck,chill-crewneck,49.99,https://images.pexels.com/photos/1006202/pexels-photo-1006202.jpeg,Comfortable crewneck with motivational message,Apparel,CDP-001,40
Women's Varsity Jacket,womens-varsity-jacket,89.99,https://images.pexels.com/photos/1040881/pexels-photo-1040881.jpeg,Classic varsity jacket for women,Outerwear,WVJ-001,15